{
  "skillId": "problem-understanding",
  "schemaVersion": "1.0.0",
  "version": 5,
  "createdAt": "2026-09-15T00:00:00Z",
  "hash": "sha256:f9f1f4d64be8bf8d0dcd41edc08cd5c3055ea7052bf73f5fdd61544f92bcc150",
  "appliesTo": [
    "problem",
    "requirements"
  ],
  "capabilities": [
    "structuredEvidence"
  ],
  "requiredInputs": [
    "userRequest",
    "goalRequirement",
    "problemFacts",
    "code",
    "runEvidence"
  ],
  "requiredTools": [],
  "goalStateWriteAllowed": false,
  "inputSchemaRef": "schemas/input.schema.json",
  "outputSchemaRef": "schemas/result.schema.json",
  "coachPolicy": {
    "completeSolutionAllowed": false
  }
}
