{
  "skillId": "binary-search",
  "schemaVersion": "1.0.0",
  "version": 6,
  "createdAt": "2026-09-15T00:00:00Z",
  "hash": "sha256:ea4fffc910bb7631903fd6d27de95b9946646628a89b17f4ccb14560f84a965d",
  "appliesTo": [
    "binary-search",
    "monotonicity"
  ],
  "capabilities": [
    "structuredEvidence"
  ],
  "requiredInputs": [
    "userRequest",
    "goalRequirement",
    "problemFacts",
    "code",
    "runEvidence"
  ],
  "requiredTools": [],
  "goalStateWriteAllowed": false,
  "inputSchemaRef": "schemas/input.schema.json",
  "outputSchemaRef": "schemas/result.schema.json",
  "coachPolicy": {
    "completeSolutionAllowed": false
  }
}
