{
  "skillId": "array-and-hash",
  "schemaVersion": "1.0.0",
  "version": 5,
  "createdAt": "2026-09-15T00:00:00Z",
  "hash": "sha256:fe789aa487bccbaee5ae129f2d85bcc92c42d6802e7a93431cc992f4e289a356",
  "appliesTo": [
    "array",
    "hash"
  ],
  "capabilities": [
    "structuredEvidence"
  ],
  "requiredInputs": [
    "userRequest",
    "goalRequirement",
    "problemFacts",
    "code",
    "runEvidence"
  ],
  "requiredTools": [],
  "goalStateWriteAllowed": false,
  "inputSchemaRef": "schemas/input.schema.json",
  "outputSchemaRef": "schemas/result.schema.json",
  "coachPolicy": {
    "completeSolutionAllowed": false
  }
}
